<!ELEMENT gamePass (discount, vat, services, games)>
<!ELEMENT discount (#PCDATA)>
<!ELEMENT vat (#PCDATA)>
<!ELEMENT services (service+)>
<!ELEMENT service (name, price, includes, image)>
<!ELEMENT name (#PCDATA)>
<!ELEMENT price (#PCDATA)>
<!ATTLIST price
          currency CDATA (€|$|£) "€">
<!ELEMENT includes (include+)>
<!ELEMENT include (#PCDATA)> 
<!ELEMENT image (#PCDATA)>
<!ELEMENT games (game+)>
<!ELEMENT game (name, image, platforms, price, release, dev, publisher, review)>
<!ATTLIST game
          id CDATA #REQUIRED>
<!ELEMENT platforms (platform+)>
<!ELEMENT platform (#PCDATA)>
<!ELEMENT release (#PCDATA)>
<!ELEMENT dev (#PCDATA)>
<!ELEMENT publisher (#PCDATA)>
<!ELEMENT review (#PCDATA)>
